{
  "$schema": "https://json-schema.org/draft/2020-12/schema",
  "$id": "https://projectrye.dev/schemas/rye.process_definition.claim.v1.json",
  "title": "Rye process definition assertion claim",
  "type": "object",
  "required": [
    "schema_type",
    "schema_version",
    "process_key",
    "state_assertion_type",
    "states",
    "initial_state",
    "terminal_states"
  ],
  "properties": {
    "schema_type": { "const": "rye.process_definition.claim.v1" },
    "schema_version": { "const": 1 },
    "process_key": { "type": "string", "minLength": 1 },
    "state_assertion_type": { "type": "string", "minLength": 1 },
    "states": {
      "type": "array",
      "minItems": 1,
      "items": { "type": "string", "minLength": 1 }
    },
    "initial_state": { "type": "string", "minLength": 1 },
    "terminal_states": {
      "type": "array",
      "items": { "type": "string", "minLength": 1 }
    },
    "description": { "type": "string" }
  },
  "additionalProperties": true
}
